{
  "domain_id": "domain_env_123_app_example",
  "hostname": "app.example.test",
  "organization_id": "org_123",
  "project_id": "project_123",
  "environment_id": "env_123",
  "route_host": "env-123.palimpsest.dev",
  "verification_status": "pending",
  "verification_token": "palimpsest-domain-verification=env_123",
  "tls_status": "pending"
}
